{
  "$schema": "../../schemas/study.schema.json",
  "schema_version": 1,
  "id": "002-mass-flow",
  "title": "Mass Flow",
  "status": "prototype",
  "reproducibility": "open",
  "seed": 27183,
  "simulation": {
    "frame_start": 1,
    "frame_end": 600,
    "fps": 30,
    "rule_genome": {
      "fields": ["analytic-flow", "phase-attractor", "trail-memory-grid", "boundary-fold"],
      "neighborhoods": ["global-field", "deterministic-local-cohort-3d"],
      "update_rules": ["advect", "align", "cohere", "separate", "avoid-trails", "wander", "steer", "integrate", "fold"],
      "mutations": [],
      "system": {
        "agent_count": 4000,
        "domain_width": 9.0,
        "domain_height": 16.0,
        "domain_depth": 4.0,
        "prewarm_frames": 30,
        "checkpoint_interval": 5,
        "review_agent_count": 4000,
        "flow_scale": 0.72,
        "flow_strength": 2.7,
        "depth_strength": 0.58,
        "phase_strength": 0.65,
        "avoidance_radius": 0.14,
        "avoidance_strength": 0.16,
        "flock_radius": 1.1,
        "flock_id_window": 90,
        "alignment_strength": 0.24,
        "cohesion_strength": 0.34,
        "separation_radius": 0.46,
        "separation_strength": 0.62,
        "tail_grid_x": 24,
        "tail_grid_y": 48,
        "tail_grid_z": 12,
        "tail_deposit_interval": 3,
        "tail_decay": 0.94,
        "tail_deposit_amount": 0.16,
        "tail_avoidance_strength": 0.72,
        "wander_strength": 0.12,
        "head_scale": 0.045,
        "trail_history_checkpoints": 25,
        "trail_smoothing_max_subdivisions": 6,
        "drag": 0.88,
        "max_speed": 4.5,
        "point_size": 0.018
      }
    }
  },
  "presentation": {
    "quality": "probe",
    "mode": "analysis",
    "look": "mass-flow-density",
    "camera": "static-observation",
    "depth_of_field": true,
    "overlays": ["phase", "speed", "density"]
  },
  "render": {
    "format": "png",
    "width": 720,
    "height": 1280,
    "output_pattern": "work/renders/002-mass-flow/probe.$F4.png"
  },
  "publication": {
    "state": "private",
    "approval_required": true,
    "outputs": ["preview-loop", "contact-sheet"]
  }
}
