{
  "$schema": "../../schemas/study.schema.json",
  "schema_version": 1,
  "id": "001-memory-field",
  "title": "Memory Field",
  "status": "concept",
  "reproducibility": "open",
  "seed": 18432,
  "simulation": {
    "frame_start": 1,
    "frame_end": 240,
    "fps": 30,
    "rule_genome": {
      "fields": ["resource", "inhibition", "occupancy"],
      "neighborhoods": ["local-sensing", "collision"],
      "update_rules": ["sense", "steer", "consume", "deposit", "decay"],
      "mutations": [],
      "system": {
        "agent_count": 256,
        "grid_width": 72,
        "grid_height": 128,
        "domain": {
          "domain_width": 9.0,
          "domain_height": 16.0,
          "boundary_margin": 0.75,
          "boundary_weight": 3.0
        },
        "agent": {
          "sense_radius": 0.8,
          "resource_weight": 1.4,
          "inhibition_weight": 1.8,
          "occupancy_weight": 0.75,
          "relic_avoid_weight": 4.0,
          "relic_tangent_weight": 1.4,
          "relic_attract_weight": 0.7,
          "max_speed": 1.25,
          "min_speed": 0.2,
          "consume_rate": 0.08,
          "dormant_speed": 0.08
        },
        "field": {
          "interaction_radius": 0.18,
          "consume_rate": 0.12,
          "deposit_rate": 0.28,
          "memory_decay": 0.08
        },
        "relic": {
          "relic_hub_radius": 0.52,
          "relic_arm_length": 1.82,
          "relic_arm_half_width": 0.13,
          "relic_orientation": 1.5707963268,
          "relic_avoid_distance": 0.7,
          "relic_attract_distance": 1.8
        }
      }
    }
  },
  "presentation": {
    "quality": "probe",
    "mode": "instrument",
    "look": "field-study",
    "camera": "static-observation",
    "depth_of_field": false,
    "overlays": ["field-gradient", "recent-memory", "agent-lineage"]
  },
  "render": {
    "format": "png",
    "width": 1080,
    "height": 1920,
    "output_pattern": "work/renders/001-memory-field/beauty.$F4.png"
  },
  "publication": {
    "state": "private",
    "approval_required": true,
    "outputs": ["archive-master", "social-vertical", "feed-portrait", "website", "preview-loop"]
  }
}
